{
  "id": "miniapp-center-hub-refactor-over-miniapp-review-queue-actions",
  "kind": "boundary",
  "prompt": "The queue actions also need work, but the bigger problem is that pending items, settings, and integrations are spread across unrelated tabs. Reorganize the top-level navigation into one obvious hub first.",
  "expected_skill": "miniapp-center-hub-refactor",
  "forbidden_skills": [
    "miniapp-review-queue-actions"
  ],
  "expected_output_sections": [
    "current navigation problem",
    "proposed hub structure",
    "page ownership and migration map",
    "migration order"
  ],
  "source_plan": "docs/routing-eval-plan.md"
}
