{
  "id": "miniapp-review-queue-actions",
  "kind": "positive",
  "prompt": "This pending queue makes users open a detail page for every item just to approve, ignore, or import it. Redesign the queue cards so common actions happen in place and refresh safely afterward.",
  "expected_skill": "miniapp-review-queue-actions",
  "forbidden_skills": [],
  "expected_output_sections": [
    "queue states and actions",
    "card interaction contract",
    "refresh and side-effect chain",
    "files or components to change first"
  ],
  "source_plan": "docs/routing-eval-plan.md"
}
